{
  "schema": "halospawns.h1FilmSettings.v1",
  "adapter_revision": 1,
  "catalogue_revision": 1,
  "engine_profile": "h1-performance-beta4-p9803-wasm-v1",
  "film_sha256": "7655c449414a0766799f6f6531052103219544b857d41997ad2abb3d318310a6",
  "raw_map_sha256": "aaaaaaaaaaaaaaaaaaaaaaaaaaaaaaaaaaaaaaaaaaaaaaaaaaaaaaaaaaaaaaaa",
  "settings": {
    "variant.name": {
      "status": "available",
      "value": "selected",
      "provenance": "recorded_variant"
    },
    "variant.game_rules": {
      "status": "available",
      "value": 0,
      "provenance": "recorded_variant"
    },
    "variant.score_to_win": {
      "status": "available",
      "value": 50,
      "provenance": "recorded_variant"
    },
    "variant.flag_pickup": {
      "status": "available",
      "value": 0,
      "provenance": "recorded_variant"
    },
    "variant.ball_pickup": {
      "status": "available",
      "value": 0,
      "provenance": "recorded_variant"
    },
    "variant.hill_order": {
      "status": "available",
      "value": 0,
      "provenance": "recorded_variant"
    },
    "variant.hill_move_s": {
      "status": "available",
      "value": 0,
      "provenance": "recorded_variant"
    },
    "variant.ctf_assault": {
      "status": "available",
      "value": false,
      "provenance": "recorded_variant"
    },
    "variant.ctf_single_flag_s": {
      "status": "available",
      "value": 0,
      "provenance": "recorded_variant"
    },
    "variant.ctf_flag_must_reset": {
      "status": "available",
      "value": false,
      "provenance": "recorded_variant"
    },
    "variant.ctf_flag_at_home": {
      "status": "available",
      "value": false,
      "provenance": "recorded_variant"
    },
    "variant.king_moving_hill": {
      "status": "available",
      "value": false,
      "provenance": "recorded_variant"
    },
    "variant.ball_type": {
      "status": "available",
      "value": 0,
      "provenance": "recorded_variant"
    },
    "variant.ball_count": {
      "status": "available",
      "value": 0,
      "provenance": "recorded_variant"
    },
    "variant.ball_random_start": {
      "status": "available",
      "value": false,
      "provenance": "recorded_variant"
    },
    "variant.ball_speed": {
      "status": "available",
      "value": 0,
      "provenance": "recorded_variant"
    },
    "variant.ball_trait_with": {
      "status": "available",
      "value": 0,
      "provenance": "recorded_variant"
    },
    "variant.ball_trait_without": {
      "status": "available",
      "value": 0,
      "provenance": "recorded_variant"
    },
    "variant.teams": {
      "status": "available",
      "value": true,
      "provenance": "recorded_variant"
    },
    "variant.respawn_s": {
      "status": "available",
      "value": 0,
      "provenance": "recorded_variant"
    },
    "variant.suicide_s": {
      "status": "available",
      "value": 0,
      "provenance": "recorded_variant"
    },
    "variant.health_pct": {
      "status": "available",
      "value": 0,
      "provenance": "recorded_variant"
    },
    "variant.shields": {
      "status": "available",
      "value": false,
      "provenance": "recorded_variant"
    },
    "variant.infinite_ammo": {
      "status": "available",
      "value": 0,
      "provenance": "recorded_variant"
    },
    "variant.fireteams": {
      "status": "available",
      "value": false,
      "provenance": "recorded_variant"
    },
    "variant.infinite_grenades": {
      "status": "available",
      "value": false,
      "provenance": "recorded_variant"
    },
    "variant.frags": {
      "status": "available",
      "value": 0,
      "provenance": "recorded_variant"
    },
    "variant.plasmas": {
      "status": "available",
      "value": 0,
      "provenance": "recorded_variant"
    },
    "variant.weapon_primary": {
      "status": "available",
      "value": 0,
      "provenance": "recorded_variant"
    },
    "variant.weapon_secondary": {
      "status": "available",
      "value": -1,
      "provenance": "recorded_variant"
    },
    "variant.skip_first_draw": {
      "status": "available",
      "value": false,
      "provenance": "recorded_variant"
    },
    "variant.motion_tracker": {
      "status": "available",
      "value": false,
      "provenance": "recorded_variant"
    },
    "variant.objectives_indicator": {
      "status": "available",
      "value": 0,
      "provenance": "recorded_variant"
    },
    "variant.friend_indicators": {
      "status": "available",
      "value": false,
      "provenance": "recorded_variant"
    },
    "variant.camo_variant": {
      "status": "available",
      "value": 0,
      "provenance": "recorded_variant"
    },
    "variant.camo_refraction": {
      "status": "available",
      "value": 0,
      "provenance": "recorded_variant"
    },
    "variant.camo_falloff": {
      "status": "available",
      "value": 0,
      "provenance": "recorded_variant"
    },
    "variant.camo_tint_r": {
      "status": "available",
      "value": 0,
      "provenance": "recorded_variant"
    },
    "variant.camo_tint_g": {
      "status": "available",
      "value": 0,
      "provenance": "recorded_variant"
    },
    "variant.camo_tint_b": {
      "status": "available",
      "value": 0,
      "provenance": "recorded_variant"
    },
    "variant.spawns_visible": {
      "status": "available",
      "value": 0,
      "provenance": "recorded_variant"
    },
    "variant.powerup_waypoints": {
      "status": "available",
      "value": 3,
      "provenance": "recorded_variant"
    },
    "variant.random_pct_visible": {
      "status": "available",
      "value": 0,
      "provenance": "recorded_variant"
    },
    "variant.footstep_sounds": {
      "status": "available",
      "value": true,
      "provenance": "recorded_variant"
    },
    "variant.kill_restores": {
      "status": "available",
      "value": false,
      "provenance": "recorded_variant"
    },
    "variant.overshield_visible": {
      "status": "available",
      "value": false,
      "provenance": "recorded_variant"
    },
    "variant.os_tint_perp_r": {
      "status": "available",
      "value": 0,
      "provenance": "recorded_variant"
    },
    "variant.os_tint_perp_g": {
      "status": "available",
      "value": 0,
      "provenance": "recorded_variant"
    },
    "variant.os_tint_perp_b": {
      "status": "available",
      "value": 0,
      "provenance": "recorded_variant"
    },
    "variant.os_tint_par_r": {
      "status": "available",
      "value": 0,
      "provenance": "recorded_variant"
    },
    "variant.os_tint_par_g": {
      "status": "available",
      "value": 0,
      "provenance": "recorded_variant"
    },
    "variant.os_tint_par_b": {
      "status": "available",
      "value": 0,
      "provenance": "recorded_variant"
    },
    "variant.os_brightness": {
      "status": "available",
      "value": 70,
      "provenance": "recorded_variant"
    },
    "variant.os_type": {
      "status": "available",
      "value": 0,
      "provenance": "recorded_variant"
    },
    "variant.omit_first_spawn": {
      "status": "available",
      "value": 0,
      "provenance": "recorded_variant"
    },
    "variant.item_spawn_s": {
      "status": "available",
      "value": 0,
      "provenance": "recorded_variant"
    },
    "variant.camo_drop": {
      "status": "available",
      "value": 0,
      "provenance": "recorded_variant"
    },
    "variant.os_assassination": {
      "status": "available",
      "value": 0,
      "provenance": "recorded_variant"
    },
    "variant.teammate_outlines": {
      "status": "available",
      "value": true,
      "provenance": "recorded_variant"
    },
    "variant.teammate_view": {
      "status": "available",
      "value": false,
      "provenance": "recorded_variant"
    },
    "variant.teammate_respawn_timers": {
      "status": "available",
      "value": false,
      "provenance": "recorded_variant"
    },
    "variant.fov_limit": {
      "status": "available",
      "value": 2,
      "provenance": "recorded_variant"
    },
    "tuning.plasma_overheat_damage": {
      "status": "unavailable",
      "reason": "not_recorded",
      "provenance": "recorded_configuration"
    },
    "tuning.plasma_grenade_stickiness": {
      "status": "unavailable",
      "reason": "not_recorded",
      "provenance": "recorded_configuration"
    },
    "tuning.shotgun_spread_constant": {
      "status": "unavailable",
      "reason": "not_recorded",
      "provenance": "recorded_configuration"
    },
    "tuning.pistol_spread": {
      "status": "unavailable",
      "reason": "not_recorded",
      "provenance": "recorded_configuration"
    },
    "tuning.plasma_climb": {
      "status": "available",
      "value": false,
      "provenance": "recorded_configuration"
    },
    "tuning.plasma_climb_gain": {
      "status": "unavailable",
      "reason": "not_recorded",
      "provenance": "recorded_configuration"
    },
    "tuning.wall_jump": {
      "status": "unavailable",
      "reason": "not_recorded",
      "provenance": "recorded_configuration"
    },
    "tuning.wall_jump_window_ms": {
      "status": "unavailable",
      "reason": "not_recorded",
      "provenance": "recorded_configuration"
    },
    "tuning.wall_jump_height": {
      "status": "unavailable",
      "reason": "not_recorded",
      "provenance": "recorded_configuration"
    },
    "tuning.wall_jump_kick": {
      "status": "unavailable",
      "reason": "not_recorded",
      "provenance": "recorded_configuration"
    },
    "tuning.wall_jump_steer": {
      "status": "unavailable",
      "reason": "not_recorded",
      "provenance": "recorded_configuration"
    },
    "tuning.wall_jump_momentum": {
      "status": "unavailable",
      "reason": "not_recorded",
      "provenance": "recorded_configuration"
    },
    "tuning.crouch_slide": {
      "status": "unavailable",
      "reason": "not_recorded",